Theme,Indicator Name,Key,Unit,Expected Type,Aim,Has Target,Min,Max,Warn Above,Aliases
Carbon Emissions,Annual Carbon Emissions,annual_carbon_emissions,tonnes CO₂,float,reduction,True,0,100000000,50000000,Carbon Footprint; Total GHG Emissions; Scope 1 and 2 Emissions; CO₂ Emissions; Greenhouse Gas Emissions; GHG Output; Total Emissions; Emissions from Operations; Emissions Indexed to Sales; Operational Emissions; GHG Emissions (Scope 1+2); Company-Wide Carbon Output
Water Consumption,Annual Water Consumption,annual_water_use,cubic meters,float,reduction,True,0,100000000,50000000,Total Water Use; Water Withdrawn; Water Usage; Water Consumption; Water Utilization; Water Footprint; Water Draw; Water Intake; Corporate Water Use; Freshwater Use; Industrial Water Use; Total Water Withdrawal; Volume of Water Used; Annual Water Withdrawal; Water withdrawal
Renewable Energy,Renewable Energy Usage,renewable_energy_use,MWh,float,increase,True,0,10000000,5000000,Renewable Energy Usage; Renewable Electricity Usage; Renewable Energy Consumed; Renewable Energy Consumption; Renewable Power Consumption; Renewable Electricity Consumed; Total Renewable Energy Use; Renewable Energy Demand; Renewable Electricity Demand; Renewable Energy Utilization; Total Renewable Energy (MWh); Total Renewable Power Used; Renewable Electricity Utilized; Renewable Electricity (MWh); Renewable Power Generated On-Site; Renewable Energy from Grid; Clean Electricity Usage; Green Power Consumption; Green Energy Usage; Green Electricity Consumed; Green Energy Load
Materials Usage,Sustainable Materials Usage Ratio,sustainable_materials_ratio,percent,float,increase,False,0,100,95,Sustainable Materials Percentage; % Sustainable Materials; Sustainable Content Ratio; Recycled Content Percentage; % Recycled Materials; Bio-based Materials Percentage; Sustainable Input Ratio; Eco-friendly Materials Proportion; Green Materials Percentage; Circular Materials Rate; Renewable Materials Percentage; Proportion of Sustainable Materials; Sustainable Sourcing Ratio; Environmentally Preferred Materials %; Low-impact Materials Percentage; Certified Sustainable Materials %
Waste Management,Waste Recycling Rate,waste_recycling_rate,percent,float,increase,False,0,100,95,Landfill Diversion Rate; Recycling Rate; % Waste Recycled; Waste Recovery Rate; Zero Waste to Landfill; Reuse/Recycling Rate; Recycled Waste Proportion; Recyclables Collected; Solid Waste Recovery Rate; % of Waste Diverted; % Waste Recovery; Recycling Performance; Waste Diversion Rate; Recycling Effectiveness
